{
  "id": 5,
  "walls": [
    {
      "z": 30,
      "hole": {
        "shape": "wide",
        "width": 2.5,
        "height": 0.4
      }
    },
    {
      "z": 64.9,
      "hole": {
        "shape": "wide",
        "width": 1,
        "height": 1
      }
    },
    {
      "z": 99.6,
      "hole": {
        "shape": "wide",
        "width": 1.67,
        "height": 0.6
      }
    },
    {
      "z": 134.3,
      "hole": {
        "shape": "tall",
        "width": 0.8,
        "height": 1.25
      }
    },
    {
      "z": 168.8,
      "hole": {
        "shape": "wide",
        "width": 2,
        "height": 0.5
      }
    },
    {
      "z": 203.1,
      "hole": {
        "shape": "tall",
        "width": 0.8,
        "height": 1.25
      }
    },
    {
      "z": 237.4,
      "hole": {
        "shape": "wide",
        "width": 2,
        "height": 0.5
      }
    },
    {
      "z": 271.5,
      "hole": {
        "shape": "tall",
        "width": 0.7,
        "height": 1.43
      }
    },
    {
      "z": 305.5,
      "hole": {
        "shape": "wide",
        "width": 1.43,
        "height": 0.7
      }
    },
    {
      "z": 339.4,
      "hole": {
        "shape": "tall",
        "width": 0.7,
        "height": 1.43
      }
    },
    {
      "z": 373.1,
      "hole": {
        "shape": "wide",
        "width": 1.67,
        "height": 0.6
      }
    },
    {
      "z": 406.8,
      "hole": {
        "shape": "tall",
        "width": 0.6,
        "height": 1.67
      }
    }
  ],
  "speed": 2.5,
  "difficulty": 0.25
}
