{
  "id": 8,
  "walls": [
    {
      "z": 30,
      "hole": {
        "shape": "wide",
        "width": 2,
        "height": 0.5
      }
    },
    {
      "z": 61.8,
      "hole": {
        "shape": "tall",
        "width": 0.7,
        "height": 1.43
      }
    },
    {
      "z": 93.4,
      "hole": {
        "shape": "wide",
        "width": 1.43,
        "height": 0.7
      }
    },
    {
      "z": 124.8,
      "hole": {
        "shape": "plus",
        "widthH": 0.6,
        "heightH": 2,
        "widthV": 2,
        "heightV": 0.6
      }
    },
    {
      "z": 156,
      "hole": {
        "shape": "wide",
        "width": 2,
        "height": 0.5
      }
    },
    {
      "z": 187,
      "hole": {
        "shape": "wide",
        "width": 1,
        "height": 1
      }
    },
    {
      "z": 217.8,
      "hole": {
        "shape": "plus",
        "widthH": 0.7,
        "heightH": 1.8,
        "widthV": 1.8,
        "heightV": 0.7
      }
    },
    {
      "z": 248.4,
      "hole": {
        "shape": "tall",
        "width": 0.5,
        "height": 2
      }
    },
    {
      "z": 278.8,
      "hole": {
        "shape": "tall",
        "width": 1,
        "height": 1
      }
    },
    {
      "z": 309,
      "hole": {
        "shape": "plus",
        "widthH": 0.8,
        "heightH": 1.5,
        "widthV": 1.5,
        "heightV": 0.8
      }
    },
    {
      "z": 339,
      "hole": {
        "shape": "wide",
        "width": 1.25,
        "height": 0.8
      }
    },
    {
      "z": 368.8,
      "hole": {
        "shape": "tall",
        "width": 0.8,
        "height": 1.25
      }
    },
    {
      "z": 398.4,
      "hole": {
        "shape": "plus",
        "widthH": 0.5,
        "heightH": 2.5,
        "widthV": 2.5,
        "heightV": 0.5
      }
    },
    {
      "z": 427.8,
      "hole": {
        "shape": "tall",
        "width": 0.4,
        "height": 2.5
      }
    }
  ],
  "speed": 2.8,
  "difficulty": 0.4
}
